id,dimension,nombre_completo,descripcion,areas_relacionadas,competencias_clave,rango_puntaje
1,Razonamiento Lógico-Matemático,"Capacidad de Razonamiento Lógico y Matemático","Habilidad para resolver problemas usando lógica matemática, reconocer patrones numéricos, realizar cálculos complejos y aplicar razonamiento deductivo e inductivo. Incluye pensamiento analítico y resolución sistemática de problemas.","Matemáticas, Ingeniería, Ciencias Exactas, Programación, Física","Resolución de problemas matemáticos, Análisis algebraico, Lógica proposicional, Razonamiento deductivo, Pensamiento analítico","0-100"
2,Comprensión Lectora y Comunicación,"Competencia en Comprensión Verbal y Comunicación","Capacidad para comprender textos complejos, comunicarse efectivamente tanto oral como escrito, interpretar información verbal y no verbal, y dominar el uso del lenguaje en diferentes contextos académicos y profesionales.","Humanidades, Literatura, Periodismo, Derecho, Educación, Comunicación Social","Comprensión lectora avanzada, Escritura argumentativa, Comunicación oral efectiva, Análisis textual, Síntesis de información","0-100"
3,Pensamiento Científico,"Capacidad de Pensamiento y Método Científico","Habilidad para aplicar el método científico, formular hipótesis, diseñar experimentos, analizar datos empíricos, y comprender principios fundamentales de las ciencias naturales. Incluye observación sistemática y razonamiento basado en evidencia.","Biología, Química, Física, Medicina, Investigación, Ciencias Naturales","Método científico, Diseño experimental, Análisis de datos científicos, Formulación de hipótesis, Observación sistemática","0-100"
4,Análisis Social y Humanístico,"Comprensión de Fenómenos Sociales y Humanísticos","Capacidad para analizar y comprender fenómenos sociales, históricos, políticos y culturales. Incluye el entendimiento de dinámicas humanas, sistemas sociales, y la capacidad de contextualizar eventos en marcos históricos y culturales.","Ciencias Sociales, Historia, Geografía, Sociología, Antropología, Ciencias Políticas","Historia contemporánea, Sociología urbana, Ciencias políticas, Filosofía ética, Antropología cultural","0-100"
5,Creatividad e Innovación,"Capacidad Creativa e Innovadora","Habilidad para generar ideas originales, pensar de manera divergente, desarrollar soluciones innovadoras, y expresarse creativamente. Incluye la capacidad de improvisación, pensamiento lateral y generación de alternativas novedosas.","Arte, Diseño, Arquitectura, Publicidad, Emprendimiento, Innovación Tecnológica","Pensamiento divergente, Innovación tecnológica, Diseño conceptual, Escritura creativa, Pensamiento lateral","0-100"
6,Liderazgo y Trabajo en Equipo,"Competencias de Liderazgo y Colaboración","Capacidad para liderar grupos, trabajar efectivamente en equipos, gestionar conflictos, motivar a otros y construir consensos. Incluye habilidades interpersonales, comunicación grupal y gestión de dinámicas de equipo.","Administración, Gestión, Recursos Humanos, Trabajo Social, Psicología Organizacional","Liderazgo transformacional, Gestión de conflictos, Trabajo colaborativo, Motivación de equipos, Construcción de consenso","0-100"
7,Pensamiento Crítico,"Capacidad de Análisis y Pensamiento Crítico","Habilidad para evaluar información de manera objetiva, analizar argumentos, detectar sesgos, tomar decisiones fundamentadas y aplicar razonamiento crítico. Incluye metacognición y evaluación sistemática de evidencias.","Filosofía, Derecho, Investigación, Auditoría, Consultoría, Análisis de Políticas","Análisis crítico, Evaluación de evidencias, Detección de sesgos, Argumentación lógica, Toma de decisiones","0-100"
8,Adaptabilidad y Aprendizaje,"Capacidad de Adaptación y Aprendizaje Continuo","Habilidad para adaptarse a nuevas situaciones, aprender de manera autónoma, gestionar el cambio, mostrar resiliencia ante dificultades y mantener una actitud de crecimiento continuo. Incluye flexibilidad cognitiva y autoregulación.","Educación, Desarrollo Personal, Psicología, Gestión del Cambio, Tecnología Educativa","Flexibilidad cognitiva, Aprendizaje autónomo, Gestión del cambio, Resiliencia académica, Autoregulación","0-100"